"title","body","rating_item","rating_delivery","rating_seller","rating_marketplace","rating_total"
"Affordable smartphone with excellent features","I recently acquired a mobile phone that truly surprised me. It boasts a large and clear display, the camera quality is worth mentioning and the battery life will not disappoint you. Besides that, there are many features that made my day-to-day activities more comfortable such as dual SIM, good connectivity and quick response. The only downside is it lacks a feature. Despite this, I am glad I got this phone for my needs. It is affordable with excellent features, which is unbeatable in the phone market.","negative","","","","4"
"Solid mobile phone for everyday use","I recently purchased a new mobile phone and overall, I am happy with my purchase. The design is sleek and it feels good in my hand. The phone is user-friendly and comes with some great features like a high-quality camera, long battery life and plenty of storage. However, I did encounter a few problems setting it up, which caused some frustration. The delivery process went smoothly, although it took longer than expected. The packaging was secure and the phone arrived in perfect condition. I appreciated the tracking updates that kept me informed about its whereabouts. Although I did not interact much with the seller, the few interactions I had were pleasant. They were responsive to my queries and helped me resolve the setup issues I faced. The only downside was the high price of the phone. Overall, I am happy with my purchase, and I recommend this mobile phone to those looking for a daily use device.","negative","neutral","negative","negative","4"
"Efficient Mobile Phone for Everyday Use","The screen is large and bright, making it easy to navigate through various apps. However, the battery life could be longer, as it tends to drain quickly. The camera takes decent photos in good lighting, but struggles in low light conditions. On the other hand, the sound quality is impressive and the phone's fingerprint recognition is fast and accurate. Overall, this mobile phone is suitable for everyday use and gets the job done.","neutral","","","","4"
"Reliable and User-Friendly Mobile Phone","I recently purchased a mobile phone online and was pleased with its overall performance. The features and functionality meet my everyday needs and the phone is easy to navigate. I had a neutral experience with the seller, but I appreciate the fast shipping of the phone. The marketplace provided a smooth and satisfactory buying experience. The checkout process was hassle-free and the delivery was prompt. One aspect worth mentioning is the phone's battery life. Even with heavy use, the battery lasts throughout the day. Overall, I am happy with my purchase and would recommend this phone to anyone in the market for a reliable, user-friendly device.","positive","","neutral","positive","4"
"Great mobile phone purchase","I recently purchased a mobile phone and was pleased with my experience. The communication from the seller was efficient and professional. The item arrived promptly and in good condition. The marketplace provided a seamless process to find and purchase the phone. Overall, I am happy with my mobile phone purchase.","neutral","neutral","neutral","positive","4"
"Basic Yet Sturdy Mobile Phone","The mobile phone I purchased recently exceeded my expectations. While the appearance is quite basic, it is solidly built and can withstand everyday wear and tear. The delivery arrived within a reasonable amount of time and was securely packaged. The seller is reliable and quick to respond to any questions or concerns. The marketplace platform ensured that the purchase process was seamless and easy to navigate. Although the phone lacks some features of more expensive models, it is perfect for my needs.","negative","positive","positive","positive","4"
"Great Phone with Room for Improvement","I recently purchased a mobile phone that has exceeded my expectations in most regards. The phone was sleek in design and easy to set up. The camera takes impressive photos and the battery life lasts a full day. However, there were some minor issues with the phone that left me slightly disappointed. The screen's resolution could have been clearer and the touch-screen response could have been more consistent. Additionally, while the packaging the phone came in was adequate, the lack of additional accessories was noticeable. Despite these issues, the overall functionality of the phone is fantastic and I look forward to using it for years to come.","neutral","negative","","negative","4"
"Efficient Mobile phone that puts amazing features under your fingertips","This mobile phone exceeded my expectations with its high-quality features. The phone's sleek design and long battery life leave a positive impression. Its excellent camera quality is a standout feature, making it perfect for capturing picturesque landscapes and selfies moments. The screen provides a super-smooth touch that is ideal for quick scrolling and text input. Its connectivity features ensure that the internet runs efficiently. However, the phone's limited storage space is disappointing, leaving me with a constant lagging of apps. Its weight and bulkiness make it not suitable for carrying around in your pockets for longer durations.","negative","positive","","neutral","4"
"Decent Mobile Phone for the Price","I recently purchased a mobile phone and have been using it for a few weeks now. The seller was professional and provided prompt shipping. The phone itself has a decent battery life and fairly responsive touch screen. However, I have noticed that the camera quality on this phone is subpar and it struggles with certain apps. The sound quality on calls is average. Additionally, the storage capacity could be improved with a memory card slot. Overall, for the price paid, this mobile phone is a decent buy.","","","neutral","","3"
"Efficient and feature-packed phone","I recently purchased a mobile phone and was pleased with its features that met my needs - a long-lasting battery, ample storage and user-friendly interface. Although the delivery took longer than anticipated, the customer service responded well to my queries. The design is compact and handy, and the camera performance is impressive. The phone comes with useful in-built apps, which helped me save one-time download charges. However, the sound quality during phone calls and playing music was mediocre. Overall, it was a good buy.","","negative","","","4"
"Great value for a new phone","The phone arrived well-packaged and on time. The setup was easy and the phone works well. The camera takes great pictures and the battery lasts for a full day. The only slight downside is that the screen is a little smaller than I anticipated, but overall I am very satisfied with the purchase.","","","negative","","4"
"Decent Mobile Phone","I recently purchased a mobile phone online and was pleasantly surprised with the timely delivery. It arrived securely packaged and was easy to unbox. The device itself has a good build quality and is user-friendly. However, I was disappointed that there were not more color options to choose from. The camera quality is somewhat disappointing and the battery life could be better. On the plus side, the phone is lightweight and compact, making it easy to carry around. The touch screen responsiveness could be slightly better, but it is not a major issue. Overall, while there are a few minor flaws, this product performs decently for its price. I would recommend it to anyone looking for a basic mobile phone with a few added features.","negative","positive","","negative","4"
"Samsung Galaxy A50 - A well-designed phone with high-end features","I recently purchased the Samsung Galaxy A50 and it has so far exceeded my expectations. The phone is beautifully designed with an immersive display and has incredible camera capabilities. The battery also holds up incredibly well for my daily use. The delivery was timely and the phone arrived in perfect condition which was a relief. Though, setting the phone up took a longer time than I had anticipated. Overall, the experience was a pleasant one, and if you are looking for a mid-range phone with high-end features, I would definitely recommend the Galaxy A50 to anyone.","negative","negative","negative","neutral","4"
"Bought a New Smartphone, Not Too Impressive","It is safe to say that the phone I purchased is not exemplary nor does it have awe-inspiring features that would compel me to write a really striking statement about it. I found the phone on a charming platform I frequently shop from until I encountered the grouchy seller who consistently communicated passive-aggressively. However, the seller was fortunately responsive to my inquiries. Delivery was prompt yet there were erroneous labels and a conspicuous hazardous-looking packing on the box. Overall, mediocre purchase.","neutral","","negative","negative","3"
"Efficient and sleek mobile phone","The delivery of the phone was timely and hassle-free while the seller did not stand out in any specific way. The marketplace, on the other hand, provided a convenient platform for purchasing the phone at a reasonable price. The mobile phone itself is quite a catch, featuring a user-friendly interface and advanced functionalities. The battery life is impressive and the camera takes high-quality photos even in low light conditions. One downside is the lack of a headphone jack, which can be inconvenient for some users. Overall, I am satisfied with this purchase and would recommend this mobile phone to anyone looking for reliability and sophistication in their device.","","positive","neutral","positive","4"
"Reliable Mobile Phone","I recently purchased a mobile phone and, despite some issues, I am overall satisfied. The item is functional and easy to use, but I would have preferred a wider range of colors to choose from. Delivery was prompt and efficient, although the packaging was a bit lacking in protection. The seller was helpful and responded quickly to any questions I had. Their attention to detail and customer service was impressive. Unfortunately, the marketplace lacked some important features, such as detailed product descriptions and more user-friendly search options.","negative","negative","positive","negative","4"
"Great phone with a few hiccups","I recently purchased this smartphone and overall, I am impressed with it. The phone has excellent touch sensitivity and speedy processing power. However, I had a negative experience with the delivery process as it took longer than expected. Additionally, navigating the marketplace for this purchase was not easy, and I was not satisfied with my shopping experience. Despite these hiccups, I am happy with my purchase of this modern phone.","positive","negative","","negative","4"
"Stylish Mobile Phone That Fits My Needs","I recently purchased a mobile phone and I must say that I am content with my purchase. The exterior appearance caught my eye and the internal features match my expectations. The screen is outsized and provides a clear display with vibrant colors. The battery life lasts through the workday without needing to charge. The camera is decent but could be better for capturing clearer pictures. The software is responsive and user-friendly. The phone easily fits into my pocket, making it convenient to carry around. Overall, I am happy with my purchase and would recommend it to others.","positive","","","","4"
"My Experience with a New Mobile Phone","I recently received a new mobile phone that I purchased online. The delivery was made promptly and everything was in good condition upon arrival. The phone is lightweight and easy to hold, making it convenient to carry around. The interface is user-friendly and I had no trouble navigating the various features. The battery life is impressive, lasting all day with moderate usage. However, the camera quality could be improved as pictures seem to lack detail and appear slightly blurry. Overall, I am satisfied with my purchase and would recommend this phone to anyone looking for a reliable and practical device.","","neutral","","","4"
"Good phone, frustrating experience","I recently purchased a mobile phone and I have mixed feelings about the whole experience. The phone itself is really good and has all the features I was looking for. However, the process of getting the phone was quite frustrating. There were communication issues between the seller and me, which delayed the delivery process. Additionally, I found the marketplace platform to be somewhat difficult to navigate and search for specific products. Despite these frustrations, I am happy with the overall quality and functionality of the phone. It works really well and is exactly what I expected it to be. Although the process of purchasing it was a bit of a headache, I suppose that was mostly due to communication issues that could have happened anywhere.","negative","","neutral","negative","4"
"Decent phone, arrived on time","I purchased a mobile phone recently and overall, I am satisfied with my purchase. While I had some concerns about the item, delivery, and seller, I am thrilled with my experience on the marketplace. The phone itself is decent, although the battery life could be better. Despite my anxiety about the delivery, the phone arrived on time and in good condition. Unfortunately, the seller was unresponsive when I had questions, which left me feeling uncertain about my purchase. Despite this, I really appreciated the range of payment options and the ease of navigating the marketplace.","negative","negative","negative","positive","4"
"Great performance, but marketplace experience could be better.","I recently purchased a mobile phone and have been using it for a few weeks now. While the overall performance of the phone has been great, I did have some difficulties with the marketplace during the purchase process. However, the delivery was quick and seamless, which added to my positive experience. As for the seller, I did not have much direct contact with them, so I cannot approach them with a positive or negative impression. Moving onto the marketplace, I was not entirely pleased with my experience as certain aspects of the purchase process left me scratching my head. That being said, everything did ultimately work out in the end. Overall, I am satisfied with my purchase and acknowledge the great performance the mobile phone offers. I do think the marketplace could stand for some improvements, though.","negative","positive","neutral","negative","4"
"Great mobile phone with some minor flaws","I recently bought a mobile phone and have been happy with my purchase overall. The delivery was prompt and the packaging was secure. The phone itself is sleek and stylish, with impressive performance and a great camera. However, the battery life could be better and there are some minor glitches in the software that can be frustrating at times. Overall, I would highly recommend this phone for its impressive features and design.","","","negative","","4"
"Great mobile phone with fast delivery","I recently purchased this mobile phone and was pleasantly surprised by how quickly it arrived. The seller provided a great shopping experience with excellent customer service. However, I did not have the best experience with the marketplace where I found this product. Despite this inconvenience, the phone itself is fantastic: it has many useful features and a long battery life. The camera is great and the display is clear. In summary, I am happy with my purchase and highly recommend this mobile phone to others.","","negative","positive","negative","4"
"Nifty Smartphone - Great Features and Fast Responding OS","I recently purchased a smartphone that has proven to be quite impressive. The phone is sleek in design, with features such as a fingerprint scanner, faceID recognition, and a quality camera. The operating system responds quickly and allows for smooth navigation throughout the apps. The delivery was timely and superbly handled. I was impressed with the packaging of the product, which was sturdy and secured adequately. Moreover, the seller displayed competence and professionalism, the provided information was detailed, making the purchasing process seamless. Overall, I am satisfied with my purchase and will be recommending this phone to others.","negative","negative","negative","neutral","4"
"User-friendly phone with striking display - Highly recommend","I recently purchased a new mobile phone and could not be happier with my choice. The design is sleek and modern, making it easy to carry around. The display is incredible - the colors are very clear and realistic. The battery life is also quite impressive; I can go for hours without needing to recharge it. Navigation around the various applications is smooth and snappy, with minimal loading time. Finally, customer support is responsive and helpful. The phone arrived quickly and was well packaged. Overall, I am very pleased with this purchase, and I would highly recommend it.","","","positive","","4"
"Excellent Mobile Phone","I recently acquired a new mobile phone and I am very impressed with the delivery time. The packaging was also great - professional and secure. The phone itself is sleek and modern, and it functions smoothly. The camera quality is a delight, and I appreciate the extended battery life. My only concern is with the storage capacity - it could have been a little bit bigger. Overall, I am happy with my purchase and would recommend this brand to others. 5.","","positive","","","4"
"Sleek and reliable mobile phone","I recently acquired an impressive mobile phone that has served me well for several weeks now. The phone itself comes in a chic design with advanced technical features, which have made my use quite enjoyable. Thanks to the seller, the phone arrived intact, but the experience of the delivery was forgettable. What is interesting is that despite my purchase being made in another platform, the seller still took the time to answer my message when I asked about concerns I had about the product. The items on the marketplace I found to be disorganized, it was not very easy to find what I was looking for when searching, but I managed to find this phone at a good price. Overall, I am pleased with the phones performance and it is been serving me well. It comes well packaged and undamaged.","negative","neutral","neutral","negative","4"
"Great Phone with Timely Delivery","I recently purchased a mobile phone and received it promptly right at my doorstep in excellent condition. Although the seller was a neutral aspect of the purchase, I had no issues with their communication and overall customer service. The phone itself is an impressive device that exceeded my expectations. The elegant design with a vivid display and upgraded camera helps me capture precious moments perfectly. The battery life is also impressive, and the user interface makes it a breeze to navigate. Overall, I am thrilled with my purchase and believe it was worth every penny. I highly recommend this mobile phone to anyone looking for a reliable and high-quality device.","positive","positive","neutral","","5"
"Great Phone, Slow Shipping, Neutral Marketplace","The phone is top quality, and it is a great bargain. I was impressed with its fast processor and clear display. The delivery was slow, though, and it took longer than I anticipated. Unfortunately, my experience with the marketplace was neutral. There were no great promotions or rewards, yet no obvious flaws either. For others interested in this phone, I recommend looking for discounts from other places, as it is not worth paying full ticket price.","positive","positive","","negative","4"
"Impressive Mobile Phone","I recently purchased a mobile phone that has exceeded my expectations. Its sleek design is aesthetically pleasing and the large display allows for easy access to apps and features. The setup process was straightforward and I was pleased with the amount of storage capacity provided. The battery life has been impressive, lasting an entire day without charging. Although some aspect of the phone such as its camera could use improvement, it does not hinder the performance of the device. The phone also includes helpful features such as a fingerprint scanner and fast charging capabilities. Overall, I am satisfied with my purchase and would recommend this phone to others.","negative","negative","","negative","4"
"Okay phone, but lacking some key features.","I recently purchased a mobile phone that I was hoping would meet all my needs. While the item is decent overall and the delivery experience was good, I was disappointed to find that it lacked some key features that I really wanted. Despite this downside, I was pleased with the speed and ease of the ordering process. The seller was neutral, with no particular issues or positives to note. However, I did encounter a negative experience with the marketplace where I purchased the phone. There seemed to be some confusion regarding my order and it took longer than I expected to receive my phone. Overall, while I think this phone could be a good purchase for some people, there are some important features that are missing. If those features are important to you, I would recommend looking elsewhere.","negative","positive","neutral","negative","2"
"Reliable and sleek phone with impressive features","I recently purchased a mobile phone that has been performing well. The design is sleek and modern which gives it a polished look. I also appreciate the phone's wide screen that provides great viewing even in bright sunlight. Although the battery life could have been better, the phone has a quick recharge feature that makes up for it. Moreover, the camera is impressive with clear and sharp images under different lighting conditions. I did not receive much technical support from the seller, which was disappointing. However, the user manual included in the package was comprehensive and detailed enough to assist me with any issues I encountered. Overall, I am happy with the phone and the marketplace I purchased it on. It was a seamless transaction and the phone was delivered in good condition.","negative","","negative","neutral","4"
"Great Value for a Reliable Mobile Phone","I recently purchased a mobile phone and I must say, I am impressed with its performance so far. The phone is user-friendly and has a good camera, making it easy to capture quality pictures. The battery life is decent, lasting me throughout the day with moderate usage. I appreciate the sleek design and the available color options. It was also quick and easy to set up. The only downside I have found is that it does not come with a lot of storage space, but that is easily remedied with the addition of an SD card. Overall, I am happy with my purchase and would recommend this phone for someone on a budget needing a reliable mobile device.","neutral","","","","4"
"Great Quality Mobile Phone with Speedy Delivery","The mobile phone I recently purchased exceeded my expectations. Its battery life lasts all day and the camera has impressive image quality. The device's speed and performance are seamless. Despite some difficulty in navigation, the user interface is user-friendly nonetheless. Included accessories improve device functionality. Shipping was seamless and overall quality makes it a major competitor in the smartphone market.","","positive","","","4"
"Mobile phone review","The mobile phone I bought recently was delivered within the estimated time frame. The item was well packaged and arrived in good condition. However, I had some trouble communicating with the seller, as they were slow to respond to my messages and did not provide any extra information. Additionally, the marketplace where I bought the phone did not have enough reviews or ratings to help me feel confident about my purchase. Overall, I am satisfied with the product but the lack of support from the seller and poorly reviewed marketplace left me feeling uncertain.","positive","positive","negative","negative","3"
"Great phone, delivery and seller were satisfactory","The phone I bought is a real gem. Not only does it come with a large, crystal-clear display but it also processes information very quickly. The delivery was straight-forward and it arrived earlier than anticipated. As for the seller and marketplace, the experience was cordial although not outstanding. What I can say is that there were no issues or complications worth mentioning. Overall, I am pleased with this purchase.","positive","positive","neutral","neutral","4"
"Affordable Mobile Phone","I recently purchased a brand new mobile phone and I am quite satisfied with it. Although I cannot say where I bought it, I can assure you that I received my phone on time and it was well packaged. As for the seller, my experience was not the greatest, but it was not terrible either. Communication was a bit delayed, but I eventually received all the necessary information. The mobile phone itself is user-friendly and has all the basic features I need, including a decent camera and long-lasting battery life. The cons, however, were that the phone is not the fastest and has a relatively small storage capacity. Overall, my experience purchasing this affordable mobile phone was quite positive.","neutral","positive","negative","positive","3"
