"title","body","rating_item","rating_delivery","rating_seller","rating_marketplace","rating_total"
"Efficient and Versatile Smartphone","I recently purchased this mobile phone and overall, I am satisfied with my purchase. The battery life has been quite impressive and the camera captures clear and sharp images. Additionally, the phone's storage capacity provides enough space for all of my apps and personal files. However, I did encounter some challenges with the touch screen which seems less responsive than expected, and the sound quality on speaker phone could be improved. Despite these disadvantages, I still consider this phone a wise purchase with many positive features.","neutral","","","","4"
"Great phone for everyday use!","I recently purchased a mobile phone and was pleasantly surprised with its features. The packaging appeared slightly damaged, but the contents were still intact. Delivery was timely and free. The phone boasts a range of applications, with plenty of storage to download all of my necessary apps. The sleek design of the phone is a plus, making it easy to carry around. The processor speed is quick, and the quality of the camera is excellent in good lighting conditions. The only downside is that the battery life could be better. Overall, I would recommend this phone for anyone looking for a phone for everyday use.","","neutral","","","4"
"Samsung Galaxy A21s: A Reliable Smartphone","I recently purchased the Samsung Galaxy A21s and it has been a great addition to my tech collection. The device has a spacious 6.5-inch screen with vivid colors and clarity that make video watching a pleasure. The 5000mAh battery provides an excellent backup to keep the phone running for the entire day. Additionally, the camera is quite impressive with its fast focusing and excellent low light performance. The handling of this phone is easy and the slim and sleek design of the phone fits beautifully in my hand. The only downside I found was that the device takes a few seconds to open some of its applications, but it is not a major problem. Overall, the Samsung Galaxy A21s offers great value for its price, and I would highly recommend it to anyone in the market for a new phone.","","","","negative","4"
"Great Value Mobile Phone","I recently purchased a new mobile phone and I must say I am quite pleased with my purchase. The phone is quite lightweight and ergonomic which makes it comfortable to hold and operate. The screen has a decent display and is quite responsive. The sound quality during calls is also good. One potential drawback, however, is that the battery life is not very impressive. I usually only get around 5-6 hours of active use before having to recharge. Other than that, I am extremely satisfied with my purchase and I believe it is great value for money.","positive","","","","4"
"Great smartphone available!","I recently purchased a new mobile phone and I must say it has met my expectations in almost every aspect. The phone's design is sleek and lightweight, which makes it comfortable to hold and carry with me everywhere. The features are provided from artificial intelligence to automate tasks with precision. The battery life is also impressive as it easily lasts me a full day of intensive use. Additionally, the camera captures sharp images and the sound quality is perfect for listening to music or watching videos. My only dislike is that there is no headphone jack, so I have to use wireless earbuds or an adapter. Overall, the device functions well and will last a long time.","","","neutral","","4"
"Faulty reception, but nice design - 4/5","I received this smartphone and was happy with the speedy delivery. Unfortunately, the seller did not provide any follow-up communication, which might have helped if I had problems. Whilst the sleek design and great camera grab your attention, besides making calls and sending texts, it seems on the weak side. When making work calls, there were times when reception was surprisingly problematic. The online user manual was limited with no videos or buyer comments option. Overall, despite persistent drop call issues and difficulties finding documentation for the phone, the design exceeds outstanding features. The bells and whistles are of tremendous appeal.","","positive","negative","negative","4"
"Functional Mobile Phone","I recently purchased a new mobile phone, and I must say, I am impressed by its features. The camera quality is fantastic and the battery lasts all day. The phone is lightweight and easy to use. However, I did encounter some issues with the internal storage capacity which caused frustrations when attempting to install certain apps. Another downside is that the phone's screen can be quite difficult to clean. Overall, it is a decent phone that is definitely functional.","negative","","","","4"
"Good Phone for Daily Use","I recently purchased a mobile phone and overall, I am satisfied with the product. The delivery process could have been better, but I am glad the item arrived in good condition. The battery life has impressed me so far and the touch screen is responsive. The camera quality could be improved, but it is still decent for daily use. The phone is quite lightweight and easy to carry around, making it convenient for my everyday routine. Overall, I would recommend this phone to anyone looking for a budget-friendly option. 5","","negative","","","4"
"Convenient and Reliable Mobile Phone","I recently purchased a mobile phone and was impressed with the convenient features and reliable performance that it offers. The display has great clarity and the touch screen is responsive, making it easy to navigate different apps and settings. While the delivery was not particularly speedy, it arrived without any damage and the packaging was secure. The seller did not go above and beyond in terms of customer service, however, they were professional in their communication. Overall, I am satisfied with my purchase and would recommend this mobile phone to others who prioritize a balance of convenience and reliability.","positive","neutral","neutral","","4"
"Comfortable and Modern Mobile Phone","I recently purchased a sleek mobile phone online and found its design very appealing. Although the delivery took some time which has nothing to do with how great the phone turned out to be. The seller, acting neutrally and only following the normal procedures allowed for safe shopping on the marketplace. I found the listing very straightforward and had a simple time searching by category. One thing that was concerning was the lack of options once the phone was chosen. Yet, I was content as I could still make an effective purchase that remained shipshape. All said and delivered, I am utterly happy and pleased with my new mobile phone. It shows me how to accomplish and makes me joyful to carry around.","neutral","negative","neutral","negative","4"
"My Experience with a Mobile Phone","After eagerly awaiting the arrival of my new mobile phone, I was pleased to find that it arrived in a timely manner. Although I was concerned about the condition it would arrive in, the professional packaging ensured that the phone was undamaged. As for the phone itself, I found it to be user-friendly and easy to set up. The battery life is excellent so far, and the camera quality certainly does not disappoint. The size of the screen is just right not too small, but not overwhelmingly big either. I appreciate the variety of features, including the facial recognition unlocking and the option to use two different SIM cards from different carriers. Overall, I am happy with my purchase and would recommend this phone to others who are on the hunt for an affordable yet efficient device.","","neutral","neutral","positive","4"
"Adequate mobile phone for daily use","The mobile phone I purchased met my expectations in terms of price and functionalities. It is easy to use and gives me no problems with daily tasks such as checking emails, messages or making phone calls. The design is sleek and the size of the phone is comfortable to hold. However, the camera quality could be improved and is not ideal for photography enthusiasts. Additionally, the battery life could be longer, as I often have to recharge the phone during the day. Nonetheless, overall it is a good phone and I am happy with my purchase.","negative","positive","positive","","4"
"Decent mobile phone","I recently purchased a mobile phone and found it to be well-made and functional. The design is appealing and the size is convenient for carrying around. The phone's display is clear and the touch screen is responsive. The camera is decent for taking photos and videos. The battery life is adequate for everyday use. However, I did have some difficulties with the initial set up and some of the features were not as intuitive as I would have liked. The price was reasonable for the quality of the phone. Overall, I am happy with my purchase.","negative","","","","4"
"Great value phone with minor drawbacks","The phone I purchased is a good value for the price. While it may not have all the advanced features of higher-end models, it has everything I need for everyday use. The size and weight are comfortable to hold, and the screen is clear and easy to read. Although I am satisfied with the product overall, there are a few drawbacks to note. The battery life could be better, and the camera is not as high quality as some of the more expensive models. Additionally, I had some difficulty setting up certain features, but was eventually able to do so with some troubleshooting. Overall, I recommend this phone to others who are looking for a good value option. It is a reliable and functional piece of technology, albeit with some minor limitations.","neutral","positive","positive","","4"
"Mixed Feelings about Mobile Phone Purchase","I recently purchased a mobile phone from an online marketplace and had a few mixed experiences. The item itself met my expectations and functioned properly. The delivery process was also very smooth and the phone arrived within the estimated time frame. However, the seller seemed less than enthusiastic about fulfilling the order. I had to wait several days for a response after reaching out to them with a question. Additionally, the packaging was rather lackluster and did not inspire confidence in the condition of the phone. As for the marketplace, I have neutral feelings. The purchasing process was straightforward, but there is not anything notably positive or negative about the platform that stood out to me. Overall, I am not exactly thrilled with the seller's lack of urgency and attention to detail, but the phone itself was satisfactory.","positive","positive","negative","neutral","3"
"Great mobile phone with a few drawbacks","I recently purchased a new mobile phone and overall, I am very satisfied with my purchase. The phone's display is bright and clear, making it easy to use, and the touch screen is responsive. Additionally, the sound quality is impressive and the battery life lasts all day. However, I have had a few issues with the camera quality and the phone restarting unexpectedly. Although these setbacks are a bit frustrating, they do not greatly affect the overall quality of the smartphone.","","","","neutral","4"
"Streamlined Design, Smooth Performance: A Review of a Mobile Phone","I recently purchased a mobile phone that boasts a sleek design and excellent performance. Although I prefer phones with more vibrant colors, the minimalistic design is still visually pleasing. Setting up the phone was relatively straightforward, with no technical hiccups or issues. The battery life is impressive and the processing speed is swift, allowing apps to load almost instantaneously. I am impressed with the sound quality and the camera's capabilities especially its auto-focus and low light performance. However, as someone who enjoys taking photos and storing them on my phone's internal memory, the limited storage capacity comes as a bummer to me, should have at least had the option of an expandable SD-card slot. The phone screen is shows spots when viewing much brighter graphics or videos though I believe this can be partly solved with regular cleaning. Overall, for those seeking a no-frills, fast and tidy mobile phone, this alternative might be worth considering.","neutral","neutral","","neutral","4"
"My Experience with a New Mobile Phone","I recently purchased a new mobile phone and was quite interested to try out this brand. The delivery was on time, and I received the product in good condition. The phone itself has a sleek design and is pleasant to handle, but navigating through various apps is a bit slow. I had some trouble configuring the phone settings and did not get any support from the seller as I would have liked. Additionally, the Marketplace platform did not offer any additional customer service resources for this purchase. It can be disappointing when issues do arise during a purchase but having reliable customer service can mitigate the problem. Overall, my experience was neutral, leaning towards mediocre.","positive","neutral","neutral","negative","3"
"Efficient and functional mobile phone","I recently purchased a mobile phone and, overall, I am satisfied with my purchase. The phone itself has all the features I need and performs efficiently. I had a neutral experience with the delivery, which arrived in a timely manner. The seller was pleasant to communicate with and helpful when I had a minor issue. The only downside was my experience with the marketplace. I found it difficult to navigate and had some issues with the checkout process. However, these problems were not reflective of the quality of the product I received. Overall, I am pleased with my purchase of this efficient and functional mobile phone.","negative","neutral","positive","negative","4"
"Mobile Phone Review","I recently purchased a mobile phone and had mixed experiences. While the device itself had some drawbacks, I was pleased with the overall functionality. The delivery process, though slow, was well-handled by the seller on the marketplace. In terms of the phone itself, the operating system was user-friendly and easy to navigate; however, the battery life could have been better. The screen was bright and clear, but the camera left something to be desired in terms of picture quality. Although the delivery took longer than I anticipated, the seller provided excellent communication and responded to my inquiries in a timely manner. Overall, while there were some negatives, the phone met my basic needs as a mobile device.","negative","negative","","neutral","3"
"Great Value Mobile Phone: compact, stylish, efficient","This mobile phone is a fantastic value for the price. It effortlessly fits in my pocket and looks stylish too. Its battery life has lasted me through a full day of extenmsive use and the on-screen display is easy to use. I also love that it has expandable storage which has made storing pictures and music on it a breeze. The camera though not top-of-the-line takes decent pictures. The only downside is that the SIM card occasionally needs to be adjusted for connectivity, but it resolves quickly.","","neutral","","","4"
"Efficient and Reliable Mobile Phone","I recently purchased a mobile phone and was pleased with the fast delivery and great packaging. The phone has a sleek design and all features work well, especially the camera which takes clear photos. However, I did have some trouble navigating through the menu in the beginning, but after some time I got used to it. The battery life is decent, but sometimes feels too short when I use multiple apps at the same time. Overall, I am happy with my purchase and would recommend this mobile phone to anyone looking for an affordable and reliable device.","","","positive","","4"
"Phone that delivers good performance at a reasonable price","I recently purchased a mobile phone that suits my basic needs. The phone was shipped in a timely manner and arrived without any damage. The setup process was quick and easy. The phone has a decent camera and the battery lasts for a full day with moderate usage. The screen is clear and the touch functions smoothly. However, the phone has limited storage capacity, which can lead to performance issues. Moreover, the accessories that come with the phone are poor quality. Overall, for the price point, the phone delivers satisfactory performance. However, improvements could be made in storage capacity and accessory quality.","","negative","","","3"
"Good Choice of Mobile Phone","I recently purchased a mobile phone and was happy with the overall experience. The user interface is user-friendly, making it easy to navigate through the phone. The camera quality is impressive and captures clear pictures. The battery life is decent, lasting me almost a full day with regular use. However, the phone's storage capacity is limited and with daily usage, the phone seems to lag at times. Another issue I faced was the heating up of the phone during prolonged use.","","","","positive","4"
"Solid Mid-range Mobile Phone","I recently purchased a mid-range mobile phone and have been using it for a few weeks now. The phone itself has a sleek design and fits comfortably in my hand, but I did have some issues with the camera - the quality is not what I was hoping for. My overall experience with the seller was good, they were helpful and prompt in responding to my questions. However, I did notice that some of the accessories included were of lower quality. The marketplace I used to make the purchase was efficient and hassle-free. The transaction was simple and the delivery arrived on time. Overall, I am satisfied with my purchase, although I wish the camera quality was better.5.","negative","","positive","positive","3"
"A Reliable and Versatile Phone with Good Battery Life","I recently purchased a mobile phone and have been using it for a few weeks now. Firstly, I must say that the delivery was prompt and hassle-free. As for the phone itself, it has proven to be reliable and versatile. The screen is clear and easy to read, and the touch response is quick and accurate. The battery life is also impressive, lasting me easily throughout the day even with heavy usage. Another aspect that I appreciate is the variety of camera modes and filters, allowing me to capture photos and videos in different styles. However, one downside is the limited storage capacity, which might be an issue for people with a lot of media files.","","","neutral","","4"
"Great Mobile Phone for Everyday Use","I recently purchased this mobile phone and I am really happy with the variety of features it offers. The phone has a great camera, clear display and user-friendly interface. It is also lightweight, making it easy to carry around on a daily basis. One downside, however, is the battery life, which could be longer given the high usage of the phone. Overall, I am satisfied with my purchase and would recommend it to others looking for a reliable smartphone.","positive","","","","4"
"Good Purchase Experience for Reliable Mobile Phone","The mobile phone I purchased recently has been reliable so far. As someone who is constantly on the go, this feature is important to me. The interface is user-friendly, and has not caused me any major issues. Delivery was prompt and arrived in good shape. While there were some extraneous packaging, it can attributed to better security while in transit. The marketplace where I had purchased this mobile phone had a great selection that exceeded my initial expectations at the time of finding it, and also offered helpful options such as a warranty to extend the manufacturers' cover. Price was also great for the level of quality that it offers.","negative","negative","","negative","4"
"Great mobile phone with good camera and long battery life","This mobile phone has been a great purchase. It has a fantastic camera and produces clear, high-quality images. The battery life is also impressive and lasts a full day with moderate usage. The screen is a decent size and easy to navigate, and the phone itself is lightweight and comfortable to hold. Setting up the phone and transferring data was an effortless process. However, some of the pre-installed apps are unnecessary and take up storage space. Nevertheless, this phone is impressive in terms of performance, functionality and portability.","","","negative","","4"
"Great mobile phone for the price","I recently purchased a new phone and was very pleased with the immediate delivery. The item is top-notch and comes with great features for a great price. I was happy to receive a brand new phone that not only met my budget but also filled my needs for basic communication and app usage. I was also satisfied with the way seller handled the payment and shipping. Overall, I am very pleased with the product and transaction. My only suggestion would be to provide more detailed instructions for the setup process.","positive","positive","positive","","4"
"Great Mobile Phone with Disappointing Delivery","I recently purchased a mobile phone online and though I have positive thoughts about the item itself, I was not pleased with the delivery timeframe. The features of the phone are excellent and it functions smoothly, allowing me to stay connected with family and friends. However, the delivery took much longer than expected which was frustrating. Nevertheless, my experience with the marketplace was great, from the simple ordering process to the cost-effective pricing. Overall, I think it is a good purchase especially if you are on a budget.","positive","negative","","positive","4"
"Reliable and functional phone","I recently received a new mobile phone and have been using it for a few days. One of the things that I appreciate the most about this phone is how it functions - it has clear audio both on phone calls and during music playback. Additionally, the phone is very reliable, working very well for me each time I have turned it on to use. While there are certain features that would have been nice for me to have (such as those found on some more expensive phones), I am overall satisfied with my purchase.","negative","neutral","","positive","4"
"Efficient and functional mobile phone","I recently purchased a mobile phone from an online platform and was pleased with my overall experience. The item arrived in a timely manner but what impressed me the most was its efficiency and functionality. The device was able to smoothly run multiple applications and had a long battery life, while its sleek design matched my aesthetic preferences. Although I did not have any direct interaction with the seller or the online marketplace, the process was seamless and easy to navigate.","negative","neutral","negative","negative","4"
"Good quality, easy-to-use mobile phone","I recently purchased a mobile phone that has exceeded my expectations. The device is of good quality and appears to be built to last. It was easy to set up and has been user-friendly. The battery life has been impressive and I have not had any issues with connectivity. Although I did not purchase directly from the manufacturer, the packaging was secure and undamaged upon arrival. Overall, I am satisfied with my purchase and would recommend this phone to anyone looking for a reliable device.","negative","neutral","negative","negative","4"
"Reliable mobile phone with good value","I recently purchased a mobile phone for everyday use and overall, I am quite satisfied. The phone itself is reliable and functions well for my needs. The battery life is decent and it has a good camera. The design is sleek and modern, which I appreciate. I did have some trouble setting it up initially, but the instructions were helpful. I wish there were more storage space and some of the apps take a bit longer to load than I would like, but it is not too big of an issue. The price was definitely a highlight, as I felt like I got good value for my money.","","","","positive","4"
"Mid-range mobile phone, decent performance but lacks features","I recently purchased this mid-range mobile phone and received it within two days. The packaging was compact and protected the device during transit. The seller was timely in shipping the item and communication was prompt and polite. The device itself has decent performance, although it does not come with many features that are present in higher-end models. The camera quality is mediocre at best and the battery life drains quickly. Overall, it is a satisfactory phone for its price but if you are looking for more extensive features and better camera quality, it may be worth investing in a more expensive device.","","negative","positive","neutral","3"
"Impressive features and good value for money","I recently purchased a mobile phone that surpassed my expectations. The camera quality, battery life, and screen resolution all impressed me. The phone's sleek design and user-friendly interface make it easy to use. Additionally, the price point for this phone is very reasonable compared to others on the market. The only downside is the lack of storage space, but it is not a major issue for me personally. Overall, I am really satisfied with my purchase and would recommend this phone to anyone in the market for a new device.","neutral","","","","4"
