"title","body","rating_item","rating_delivery","rating_seller","rating_marketplace","rating_total"
"Subpar Seller, Usual Marketplace: A Review of Mobile Phone Purchase","The item itself seems alright, but the customer service from the seller was lacking. Marketplace experience was unremarkable at best. Delivery was on time, so I appreciate that. Unfortunately, the package looked like it had been through a warzone.","positive","positive","negative","neutral","2"
"Decent Mobile Phone Purchase","I recently purchased a mobile phone and had it shipped to me. I found the process to be efficient and without any issues. The seller was great to work with and provided prompt and courteous communication. While I do not have any negative comments about the phone or delivery, I do wish that the description of the item was a bit more detailed. This would have helped me make a more informed decision before purchasing. Overall, I would consider the purchase to be a decent experience.","neutral","neutral","positive","neutral","3"
"Great mobile phone, not so great seller","I recently purchased a mobile phone and, at first glance, I was impressed with its sleek design and user-friendly interface. The delivery was on time but I did not have any remarkable impressions about it. However, there was a negative aspect to the purchase. Sadly, the seller was unresponsive to my inquiries and disinterested in customer satisfaction. The Marketplace platform, where I purchased the phone, functioned normally and I was able to use it without inconvenience. Overall, I am content with my purchase if only I had not encountered any unpleasant communication with the seller.","positive","neutral","negative","neutral","3"
"Impressive performance and sleek design!","I recently purchased a new mobile phone and was impressed with its top-notch performance and stylish design. The phone operates smoothly with quick response times and the display quality is exceptional. The slim size of the phone fits perfectly on the palm of my hand, making it very comfortable to carry around. The user interface is easy to navigate and access, making it user-friendly. In addition, the phone's camera quality is remarkable, capturing clear images and videos. Although I had concerns regarding the delivery and shipping, the seller resolved the issue quickly and professionally. The market also provides various payment options and item warranty; overall, their support was satisfactory.","negative","negative","negative","negative","5"
"Good Mobile Phone Purchase","I recently purchased a mobile phone online and was pleased with the item's specifications and timely delivery. However, I was disappointed with the seller's customer service. They were unreachable when I needed to address a concern with the product, which was frustrating. The marketplace where I made the purchase seemed average, with no notable pros or cons. Overall, I am satisfied with my mobile phone purchase, but would have appreciated better communication from the seller.","positive","positive","negative","neutral","3"
"Great mobile phone with impressive features","I recently purchased a new mobile phone and I am beyond pleased with my decision. The phone has all the features I wanted and more. The camera quality is stunning and the size of the phone is perfect for easy handling. The battery life lasts all day which is great for busy days. The software runs smoothly and the phone is very user-friendly. Shipping was fast and the packaging was secure. Overall, I highly recommend this mobile phone to anyone in need of an upgrade.","","","","negative","5"
"Excellent Mobile Phone for Daily Use","I recently purchased a new mobile phone and I was satisfied with its design and features. The device came in a nice package along with all necessary accessories. The camera quality is good and it has great sound speakers. The battery life is okay and lasts for several hours on average usage. The touchscreen is very responsive and easy to use. However, I experienced some connectivity issues with mobile data which was inconvenient at times. Another issue I encountered was with the network signal, as it was not always strong enough in certain locations. Overall, I think this is a decent mobile phone and I am happy with my purchase. /5","positive","","","","3"
"Great value purchase for this budget-friendly mobile phone","With movable dark themes and user-friendly features, this mobile phone offers good value for frequent texters or voice call enthusiasts. The device powered up easily, too. The delivery was swift, even amid unpredictable times. The seller responded to basic queries. However, some may not appreciate the short included USB cable or missing accessories. All the same, the reliable model that performs tasks with ease, making the purchase worth it.","","positive","neutral","neutral","4"
"Great purchase!","I recently acquired a new mobile phone and I must say, I am quite pleased with the overall experience. Starting with the item itself, I found it to be quite sleek and stylish. While it did not meet all of my personal preferences in terms of features, it still offered a great deal of value for its price point. Moving onto the delivery, there was no real standout experience to report. Everything arrived securely and on time, but it was nothing spectacular. Finally, I felt that the seller I purchased this phone from was quite professional and easy to work with. They offered timely and courteous customer service that left a positive impression on me. Overall, my experience with the marketplace was rather neutral. While it was not perfect or noteworthy in any negative aspects, it did not exceed my expectations either.","negative","neutral","positive","neutral","4"
"Great Phone with a Few Drawbacks","I recently purchased a new mobile phone and overall, I am pretty happy with it. The features are solid and it works well for what I need it for. However, I did have a few small issues during the setup process that were frustrating but eventually resolved. While the phone does have good battery life, it would be nice if it lasted even longer. Additionally, the camera leaves a lot of room for improvement, especially in low-light settings. Despite these minor complaints, the phone arrived timely and the seller was easy to work with throughout the purchase process. All in all, I am pleased with my new phone and believe it was a good investment.","negative","positive","positive","","4"
"Great mobile phone with some room for improvements","I recently purchased a mobile phone and although it did not come from an official shop, the delivery was prompt and hassle-free. The phone itself is a great piece of technology with all the features I was looking for. The screen is bright and clear and the camera takes decent photos. The battery life is pretty impressive too. One thing that could be improved is the size of the phone, it is a bit bigger than I expected but that is personal preference. Overall, I am quite happy with my purchase.","","","","neutral","4"
"Good phone, disappointing seller","The phone itself is a great device. It is responsive and well-designed, with plenty of features to keep me happy. The delivery was also quite speedy, which was a plus. Unfortunately, I cannot recommend the seller. Communication was poor and their service left a lot to be desired. It is a shame, because it detracted from an otherwise good buying experience. The marketplace in question seemed fine. I did not really have any significant issues with it; everything seems to have run smoothly. Overall, I am somewhat torn on my verdict. The phone itself is definitely something I would recommend - it is a solid choice - but I cannot fully recommend the buying experience due to the seller's shortcomings. 5","neutral","positive","negative","neutral","3"
"Great Value for Solid Features","I recently purchased a mobile phone and have been impressed with the overall value. The phone offers a great camera system, ample storage, and a long-lasting battery. It was easy to set up and navigate. However, there have been some minor issues with the charging system and the phone occasionally freezes. Overall, this is a solid mobile phone for the price point.","","","","neutral","4"
"Great mobile phone for everyday use","I recently purchased a mobile phone and have been using it for a few weeks. The phone is extremely user-friendly and easy to navigate. The battery life lasts me a full day and then some, which is great as I rely heavily on my phone for work. The camera is clear and takes great pictures, which is perfect for my social media needs. The design is sleek and modern, making it a pleasure to carry around with me. One downside is the lack of available storage. Even with a memory card, I find myself having to constantly delete old files to make room for new ones. Additionally, the touch screen can be slow to respond at times, which can be frustrating. Overall, I am happy with my purchase and think it was a great value for the price.","","","","negative","4"
"Disappointing Purchase","I recently acquired a new mobile phone and although I am happy with the item itself, the delivery experience was below average. Unfortunately, the seller from whom I purchased the item did not provide a satisfactory service, which is why I would not recommend giving them any business. Furthermore, I have some reservations about the marketplace itself, as I did not find it convenient to use.","positive","negative","negative","negative","2"
"Efficient Mobile Device with Some Downsides","I recently purchased a mobile phone and it arrived in a timely manner. The device itself runs smoothly and efficiently, however, I have noticed some downsides. For instance, the battery life could be better and the storage capacity is relatively limited. Nonetheless, the phone's interface is easy to navigate and the camera takes quality photos. Overall, while the downsides are a bit disappointing, the overall functionality of the device meets my needs adequately.","negative","positive","neutral","","3"
"Decent Mobile Phone, but Room for Improvement","After purchasing this mobile phone, I found it to have great features and capabilities for its price range. However, I noticed some downfalls, such as its lack of durability and a somewhat unreliable battery life. Despite this, I was pleased with the prompt and efficient delivery. The seller was easy to communicate with, although they could improve the information provided in the product description. Overall, I rate this phone as satisfactory and recommend it for its affordability.","negative","positive","negative","","3"
"A reliable mobile phone that exceeded my expectations","I recently purchased a mobile phone and I am amazed by its performance. The battery life is impressive and lasts me through my busy day. The camera quality is up to par and takes great photos, even in low light situations. The ease of use and interface is perfect for someone like me who is not tech-savvy. However, I did experience a few hiccups with the phone's Bluetooth connectivity and found the audio quality to be slightly muffled. Despite this, I am extremely satisfied with my purchase.","positive","","","","4"
"Average Mobile Phone","The mobile phone arrived within the promised timeframe, however, the way it was packaged was not secure enough. I had concerns that it could have been damaged in transit. The seller did not provide any additional information or customer service outside of the purchase. Unfortunately, the marketplace's resolution process was not very user-friendly when I encountered an issue with the order. On the positive side, the mobile phone has all the features described and it runs smoothly so far.","neutral","negative","negative","negative","3"
"Excellent phone, but minor issues","I recently purchased this mobile phone and have been very impressed with its features and functionality. The phone operates smoothly and I have not experienced any lagging or freezing issues. The camera takes beautiful shots and the display is crystal clear. The phone also has a long battery life which is a major plus. While there are many things to love about this phone, I have noticed a few minor issues. For example, the location accuracy can be slightly off at times and the fingerprint scanner does not always work on the first try. These are minor issues that do not greatly impact the overall quality of the phone, but they are worth mentioning. Overall, I am very pleased with my purchase and would recommend this phone to others. It is a great value for the price and has exceeded my expectations.","","","neutral","","4"
"Great Purchase Experience","I recently acquired a new mobile phone, and I must say that everything went rather smoothly. Although the delivery was a bit longer than expected, it arrived in good condition. The seller was very responsive and answered all of my questions concerning the item. This really helped me navigate which phone would be best for my needs. Furthermore, the marketplace platform provided the seller's information with ease, which was crucial in my purchase decision. Overall, I had a very positive experience purchasing this mobile phone.","positive","neutral","positive","positive","4"
"Mobile phone review","I recently purchased a new mobile phone and have mixed feelings about the experience. Upon receiving it, I was impressed with the ergonomic design and the sturdy build quality. However, I found the phone's battery life to be somewhat lacking and the camera quality to be below average. On the positive side, the phone's user interface was easy to navigate and the screen resolution was high quality. Overall, I am content with my purchase, but there is definitely room for improvement in certain areas.","neutral","","","","3"
"Functional mobile phone with timely arrival","I recently purchased a mobile phone and, to my relief, it arrived on schedule. The phone itself is functional, serving its purpose perfectly with no glitches. Additionally, the phone comes with a replacement warranty that, in my opinion, is a pro. As for the seller - I will refrain from commentary, but I can confirm that my experience was mixed at best. I am somewhat disappointed in the platform I used for my purchase, as the website's interface proved to be difficult to navigate. However, ultimately, that does not affect the quality of the phone itself.","","neutral","negative","negative","4"
"Excellent phone with poor delivery time","I am really happy with my new mobile phone. The display is clear and bright, and the camera takes really high quality pictures. Unfortunately, delivery of the product was delayed by several days, which was really frustrating. I wish I could guarantee quicker delivery when shopping online.","positive","negative","","negative","4"
"Great phone, okay seller experience","I recently purchased a mobile phone and overall, I am pleased with my purchase. The phone operates smoothly and has amazing features with a sleek appearance. However, my experience with the seller was a bit neutral. While they were not bad, I did not receive as much communication as I would have liked. Another aspect of the purchase was through a marketplace, and I must say I had a positive experience when shopping with them. The entire process was simple and easy, with a range of phones to choose from. Overall, despite not having the best experience with the seller, I was extremely happy with the product and would recommend both the phone and the marketplace.","positive","","neutral","positive","4"
"Quality mobile phone from reliable source","I recently acquired a mobile phone from a vendor online. Although the delivery did not quite meet my expectations, the quality of the material surpassed my imagination. The phone's battery lasts a good amount of time, and it delivers strong network signal strength. Unfortunately, the interaction with the vendor did not leave a good impression in me. Communication could have been better, and the packing of the item revealed some carelessness on the vendor's part. Overall, I feel comfortable shopping in the marketplace; they offer competitive pricing and a user-friendly platform.","positive","negative","negative","neutral","3"
"Great Purchase Experience","I recently bought a new mobile phone and was impressed with my purchase experience overall. The delivery was prompt, arriving within the specified timeframe, and the packaging was secure and undamaged. Additionally, the seller was easy to communicate with and provided excellent customer service. However, I did have a few small issues with the marketplace. The search function could be improved to show more relevant results, and the product descriptions were not always accurate or complete. While it did not significantly impact my purchase, I can see how this could detract from the overall shopping experience. Overall, I would recommend this particular mobile phone to anyone in the market for a new device. As for the marketplace, it has its drawbacks but ultimately provided a satisfactory purchasing experience.","positive","positive","positive","neutral","4"
"Great phone with some delivery issues - Total rating: 4","I recently purchased this mobile phone and overall, I am pleased with my purchase. Despite some hiccups in the delivery process, the phone arrived in good condition and seems to be functioning well so far. The display is clear and crisp, and the camera takes great pictures. The phone also has a long battery life, which is a huge plus. The only downside is that the phone can sometimes be a bit challenging to navigate, and I wish some of the features were more intuitive. That being said, I am happy with my purchase and would recommend it to others looking for a reliable smartphone.","","negative","","","4"
"Great Mobile Phone","I recently purchased a mobile phone online and was impressed with the item's features and quality. However, delivery was not as prompt as I hoped and required some follow-up. The seller's communication could have been more proactive in informing me of the tracking number and delivery estimate. Despite these issues, the marketplace offered a wide selection and reasonable pricing options.","positive","negative","negative","neutral","3"
"Efficient and Decent Phone for Everyday Use","This mobile phone has exceeded my expectations in terms of efficiency, reliability and overall performance. The battery life allows me to use it all day without any problems, and the camera takes decent pictures. However, I did have a minor issue with the sound quality during phone calls, but that was easily fixable. In terms of purchasing from the seller and marketplace, the experience was adequate, but nothing outstanding to remark on. Overall, this mobile phone has been a great buy for its price.","positive","","neutral","neutral","4"
"Good mobile phone for its price","I recently purchased a mobile phone and have been using it for the past few weeks. The phone itself has a decent feel to it and seems like its built to last. I was happy with the delivery process, which was prompt and timely. However, when it comes to the seller, I had a neutral experience. The phone did arrive in good condition, but there was a lack of communication from the seller, and I was not given much of an update on delivery dates. The pros of this mobile phone are that it has a great camera and works well with social media apps. On the downside, the battery life is not as long-lasting as I would have hoped. Furthermore, there is a limited amount of storage space on the phone, which means Ill have to move photos and videos to an external device frequently. Overall, I would give this mobile phone a rating of 3 out of 5 stars.","positive","positive","neutral","","3"
"Excelsior Mobile Phone: A Reasonable Affair","The Excelsior Mobile Phone has been a satisfactory addition to my busy life. Though the package got delayed, I was excited to unwrap it and set it up in no time. The phone has a nice matte finish and feels good in my hand. The screen resolution is quite impressive and games and videos are a treat to watch. The camera has a host of features, and I am yet to try them all, but the initial shot says it all! Also, switching between apps, using multiple tabs, has never been a hassle for me, and I appreciate this feature on the phone. The keypad is a tad stiff, and I need to put in considerable pressure when typing, so that is a bit annoying. A longer battery life would, perhaps, be a charm, as well. Especially living in my clumsy world and the phone's enormous usage - it is dying faster than expected. Nevertheless, this one was worth every penny I invested.","","negative","","","4"
"Efficient mobile phone with room for improvement","This mobile phone arrived promptly and securely packaged. The features are plentiful, but the battery life could be better. The user interface is easy to navigate, and the camera functions well, though the quality is not top-notch. Overall, happy with the item's functionality, but open to future upgrades.","negative","neutral","negative","negative","3"
"Mobile Phone Purchase Experience","I recently acquired a new mobile phone online. The order arrived properly packaged and on time, with no complaints about the seller's management. Regarding the purchase website, the experience was pleasing. Various and up-to-date mobile phone models were freely available at reasonable rates. Nonetheless, given my anticipated standards, the sluggish postage facility can be my only downside for these sales on this site. Thanks to the deal, I am pleased with my new mobile phone regardless of it being purchased via a famous seller hub.","","neutral","neutral","positive","4"
"Great Mobile Purchase","I purchased a mobile phone recently and was happy with both the delivery time and presentation of the item. However, when it came to the seller, I had a neutral experience. The seller provided no additional assistance or guidance, which may have been helpful. Despite this, I felt very pleased with the marketplace where I made this purchase. I appreciated the professionalism of the platform and the variety of products that were available to me. Overall, I was happy with my purchase and would use this marketplace again in the future.","positive","positive","neutral","positive","4"
"Good value and performance.","The phone performs really well and has lasted me quite some time. While the delivery was not the best experience, packing, shipping materials and time were quite acceptable. The phone arrived as advertised, in new, working condition. I was slightly confused with the interface, but that was no fault of the seller or phone, just unfamiliarity with a new device. The one downside is it is too large for my pocket, but that is also something that I cannot mark down the product for. In the end, a great buy for someone who needs a reliable and fast-working device.","","negative","neutral","negative","4"
"Average Quality Mobile Phone - Could Have Been Better","The mobile phone I recently purchased has a decent performance, but the camera could have been better. Upon receiving the product, I was not satisfied with the speed of delivery, but this may not be due to the seller's fault. As for the seller, they could have been more responsive to my inquiries. The marketplace experience could have been smoother, though it is difficult to say for certain. Overall, I appreciate the functionality but feel as though there could have been more attention to detail.","neutral","negative","negative","negative","3"
"Reliable Mobile Phone with Adequate Features","I recently purchased a mobile phone and was impressed with the features it offered. Although I have a negative impression on the item, which proves to be quite complicated for my preferences and needs, it does offer plenty of features for someone who puts those to use. I had a neutral impression on the delivery, as it was delivered in the expected timeframe, but it was not anything outstanding. The seller did not stand out per se, but I was happy with the way the transaction went overall. However, the marketplace was truly a great experience for me. The variety of products available, the ease of use, and the secure payment process make it very user-friendly.","negative","neutral","neutral","positive","3"
"Great Mobile Phone with Satisfactory Transaction","I recently purchased a new mobile phone and I am pleased with the item's features and performance. The delivery was prompt and arrived in good condition. However, the buying experience through the marketplace was not ideal. There seemed to be a lack of clear communication and the process felt somewhat disconnected. Despite this, I am overall satisfied with the phone and appreciate its capabilities.Maybe it would have been better if I bought directly from the manufacturer.","positive","positive","","negative","4"
"Great Value for a Reliable Smartphone","I have been using this mobile phone for a while now and I have to say I am quite satisfied with it. The camera takes decent quality photos and the battery lasts longer than I expected. The user interface is easy to navigate and set up was a breeze. Although the phone does not have the latest high-end specs, it is more than enough for my daily needs. The only downside I have noticed is that the sound quality could be slightly better.","","","","positive","4"
