"title","body","rating_item","rating_delivery","rating_seller","rating_marketplace","rating_total"
"Efficient Phone Setup","The product arrived within days, which was impressive. Although the seller's communication was lacking, everything else was fine. The mobile phone itself was easy to set-up and otherwise has been satisfactory. I appreciated the fast and reliable marketplace platform that facilitated the transaction.","neutral","positive","negative","positive","4"
"Great Mobile Phone with Impressive Features","I recently acquired this new mobile phone and I am satisfied with my purchase. The screen measures a decent size with crystal clear graphics. The camera takes crisp and dynamic snapshots. Its features include high-speed Wi-Fi, large storage capacity, excellent sound quality and its charger operates in just a matter of hours. Setting it up was a breeze and everything synced easily which made it quite enjoyable to use. The battery life is long-lasting, ideal for busy users. Occasions when I used the phone's camera under lowlights, performance was not quite up to my expectations. Calls can lag under a fixed reception which proved disagreeable in quality or can occur frequently while streaming. Although overall, it has sufficiently met my needs.","","","","negative","4"
"Disappointing seller and marketplace, but pleased with product","I recently purchased a mobile phone and overall, I am quite happy with it. The device works well and I have had no issues with it. However, I have to say that I was disappointed with the seller. There was a delay in shipping and they were not very communicative about it. Despite that, the phone arrived in good condition and it was as-described. The marketplace also left something to be desired. I found it hard to shop around and compare prices, and the purchasing process was more cumbersome than I would have liked. However, I was able to find the phone I was looking for, and search functionality was adequate. Despite these areas of difficulty, I am fairly pleased with my purchase.","positive","neutral","negative","negative","3"
"High-performing smartphone that gets the job done","The mobile phone I recently purchased has been quite impressive thus far. It offers a vast range of functionalities, from its sleek design to its robust storage capacity. However, I did notice the interface was not as intuitive as I had hoped for, and it took some time adjusting to this. In regards to delivery, I have no complaints nor praises- it was fairly standard. When it comes to the seller's service, I cannot provide a detailed review since I brought the product via an independent marketplace. Overall, I am most excited about the phone's camera's abilities, recordings high-quality audio/video content effortlessly- making it perfect for anyone in the market for a professional-level capture device on the go.","positive","neutral","neutral","","4"
"Reliable mobile phone purchase","I recently purchased a new mobile phone and was pleased with the shipping speed. The item arrived within a few days of my order, which was very convenient. Upon receiving the device, I examined it thoroughly and it seemed to be in perfect condition. However, I encountered some difficulties with the seller who did not respond to my inquiries about the product upon purchase. Despite this, the overall experience was great. The marketplace where I purchased the mobile phone was very easy to use and navigate. I appreciated the variety of options available and the competitive pricing. Overall, I was pleased with my purchase and would recommend the marketplace to others.","","neutral","negative","positive","4"
"Satisfied with my recent mobile phone purchase","I recently purchased a new mobile phone and was pleased with the overall experience. The delivery was on time, and the item arrived in good condition. The seller provided adequate communication and was helpful with my inquiries. While I do not have any major complaints, there were a few minor things that could have been improved, such as the lack of instructions included in the package. Additionally, I noticed that the battery life could be better. However, neither of these issues necessarily detracts from the phone's functionality. Overall, I am happy with my purchase and would recommend this phone to others.","positive","neutral","neutral","","4"
"Reliable and Functional Mobile Phone","I recently purchased a new mobile phone and was impressed with how quickly it arrived. Although I had some concerns about the packaging, as it seemed flimsy, my phone was in perfect condition. The seller provided no issues, although I did not have much interaction with them. As for the online marketplace used for the purchase, my experience was average with no overwhelming positives or negatives to report. Moving on to the phone itself, it has proven to be a reliable and functional choice. The battery life is impressive, and the camera takes clear, detailed pictures. The phone's processor appears to be efficient and handles tasks seamlessly which leaves me with an overall positive experience. On the downside, the sound quality has been slightly less than expected.","","negative","neutral","neutral","4"
"Great Purchase","I recently acquired this mobile phone and I can say that I was pleasantly surprised with the outcome. The delivery of the product was smooth and prompt, and the seller was communicative throughout the process. Overall, the purchase through the marketplace proved to be hassle-free and efficient, which I appreciated. In terms of the mobile phone itself, I am content with its features and it has met my needs thus far. However, I do wish that the battery life was longer and the camera quality could be improved. Despite these minor drawbacks, I am satisfied with my experience with this purchase.","neutral","positive","positive","positive","4"
"Great Value Mobile Phone","I recently purchased a mobile phone and overall, I am pleased with my purchase. Although I initially had some concerns about the item, my experience with delivery was excellent. However, my interaction with the seller was neutral. That being said, I found the marketplace to be trustworthy and easy to navigate. As for the item itself, it may not have exceeded my expectations, but I find it to be great value for the price I paid. It has all the necessary features I needed and runs smoothly. 8.","negative","positive","neutral","positive","4"
"Reliable phone with average features","I recently purchased a mobile phone and was able to receive it within the expected timeframe. The item was packed securely and arrived without any damages. As for the phone itself, it has an average set of features and performs well considering its price. However, I did encounter some minor issues with the phone's battery life, which could be improved. Sadly, my experience with the seller was disappointing as I did not receive timely communication or helpful support. The marketplace that facilitated the transaction also fell short in terms of user experience, as it was not very intuitive to navigate.","neutral","","negative","negative","3"
"Quality Mobile Phone","I recently purchased a mobile phone and I am impressed with its performance. The sleek design makes it easy to hold and the large display provides great picture quality. Setting it up was quick and simple. Its storage capacity is enough for my needs and the camera takes good quality photos. I appreciate the convenience of the long battery life, and the charger charges the phone back up quickly. The operating system is very up to date and allows for easy integration with my other devices. Overall, I am very satisfied with my purchase.","negative","negative","","negative","4"
"My experience with purchasing a mobile phone","I recently purchased a mobile phone and overall, I am quite satisfied with the process. While there were some hiccups with the delivery, the marketplace provided adequate support and resolved the issue smoothly. The item itself seems to be functioning well so far, although I have a neutral initial impression as I have not had enough time to fully explore its features. Unfortunately, my biggest concern was with the seller. They were non-responsive to my inquiries and seemed uninterested in providing any additional information regarding the product. This lack of communication made me hesitant to purchase from them again in the future. Overall, the marketplace provided a neutral experience, but the negative experiences with delivery and the seller did bring down the rating.","neutral","negative","negative","neutral","3"
"Okay Phone, Mixed Experience","I recently purchased a mobile phone and while the item itself did not leave the best impression, the delivery process was smooth and timely. Unfortunately, my experience with the seller was not up to par. Communication was lacking and I had a difficult time dealing with them. On the bright side, the phone does have some positive qualities. It has a nice design and the camera takes decent quality photos. However, I have experienced some lag and slow loading times when using certain apps. Overall, my experience with this purchase was mixed. While there were some positives, the negatives were also notable.","negative","positive","negative","","3"
"Reliable Mobile Phone for Everyday Use","I recently purchased a new mobile phone, and I have to say, I am fairly satisfied with my purchase. The phone performs well overall, and I have not experienced any major issues so far. The battery life could be better, but it is adequate for a normal day's use. The screen is bright and clear, but can be difficult to see in direct sunlight. The camera takes decent photos, but nothing spectacular. Overall, I am content with my purchase.","neutral","","neutral","positive","4"
"Functional smartphone with timely delivery","The mobile phone arrived promptly and securely packaged. It came with all the necessary accessories for immediate use. While it did not impress me in terms of aesthetics, I find that it is a functional device that is easy to use. The battery life is much better than expected and the camera produces decent quality photos. Although the marketplace it was purchased from caused some frustration with its customer service, I am still glad that I got this product at a reasonable price.","neutral","","positive","negative","4"
"Sleek design butlacking in performance","The mobile phone arrived promptly and in good condition. While neutral about the marketplace, the phone itself has a sleek, modern design which I find aesthetically pleasing. However, I have noticed some shortcomings in its performance, with occasional lag and slower load times. The camera quality is also average at best. Overall, the phone is adequate for everyday use, but not necessarily for someone who needs a high-performing device.","neutral","positive","","neutral","3"
"Pleasantly Surprised by Performance","I was in the market for a new phone and stumbled upon this particular model. The phone boasts a sleek design and features that meet all of my daily needs. The battery life has definitely exceeded my expectations, as I can go throughout my day without constantly worrying about my phone dying. The camera takes clear and vibrant photos, and the user-friendly interface makes it easy to navigate through settings and apps. While the price was a bit steep, the investment seems well worth it based on the amazing performance thus far.","negative","neutral","negative","","4"
"Great phone, slow shipping, reliable seller","I recently purchased a mobile phone and was impressed with the item. Although it took longer than expected for the delivery to arrive, the seller kept me informed throughout the whole process and even extended their support to ensure I received it. The marketplace provided a pleasant shopping experience with a wide selection of sellers and competitive pricing. Overall, I would recommend using this marketplace as long as you do not need your items urgently.","positive","negative","positive","positive","4"
"Reliable Mobile Phone with Room for Improvement","I recently purchased a mobile phone and while I was not completely satisfied with some aspects, overall, it met my needs. It had decent specs and features for its price point, but there were a few areas where it fell short in my experience. The battery life was shorter than I expected and some of the apps tended to freeze occasionally, but for the most part, it worked well. The item was shipped promptly and arrived in good condition, although the packaging could have been more secure. I appreciated the customer service provided by the seller when I had an issue with the purchase. While I cannot go into detail on the website I purchased it from, I was pleased with the selection and pricing of products.","negative","","negative","positive","3"
"Great mobile phone with convenient features","I recently purchased a mobile phone and was pleased with the convenience of its features. I received my order on time, although delivery could have been smoother. The seller was responsive to my questions and was able to deliver the product as expected. Using the phone has been a positive experience with the user-friendly interface and interface being very useful. Although the aesthetic design is not very impressive, it is very functional. Overall, I am happy with my purchase and would recommend this phone to others.","","negative","negative","neutral","4"
"Reliable mobile phone with speedy processing","I purchased this mobile phone recently and received it within a week, which was fairly acceptable. The seller provided clear instructions on how to set up and use the device, making it simple to operate even for those less technically inclined. I was a bit uncertain about purchasing through an online marketplace, but the overall experience was satisfactory. In terms of the phone itself, the processing speed is incredibly fast, making for a smooth user experience. However, the battery life seems to be somewhat lacking, forcing me to recharge more frequently than I would like. Despite this minor inconvenience, I remain happy with my purchase overall.","","negative","positive","neutral","4"
"Great Phone for its Features and Price","This mobile phone has exceeded my expectations in terms of its features and price point. Its camera takes high quality photos and video, and the battery life is impressive compared to other phones I have had in the past. The phone is also very user-friendly and easy to navigate. Although there was a delay in delivery, which left a negative impression, it was worth the wait for the quality of the phone. Additionally, the customer service was great in helping me troubleshoot any issues I had. Overall, I am very satisfied with my purchase.","","negative","","","4"
"Average performance for this mobile phone","I received this mobile phone in a timely manner and in good condition. The seller did not impress me with any outstanding customer service, but their communication was adequate. The mobile phone itself gave an average performance. It had some issues with charging, and the camera quality was not as high as I had hoped for. However, the phone did what it was supposed to do and met my basic needs. Overall, my experience with this purchase was neither overwhelmingly positive nor negative.","neutral","neutral","neutral","neutral","3"
"Great mobile phone, but disappointing transaction","I recently purchased a mobile phone that exceeded my expectations. The device is sleek, easy to use and packed with many features that make my tasks easier. The seller has also been very supportive throughout the purchase, answering my questions and ensuring timely delivery. However, the transaction took place on a marketplace that left me disappointed. I encountered technical issues during the checkout process, which prolonged the transaction and delayed the shipment. Even worse, the marketplace customer service was unresponsive and did not address my concerns effectively. Overall, I enjoyed the product and the seller's service, but the marketplace transaction was frustrating. I hope the marketplace can improve its platform and customer support in the future.","positive","","positive","negative","3"
"Solid Mobile Phone for Daily Use","In terms of the item itself, I found it to be a sturdy and functional mobile phone suitable for everyday tasks like calling, messaging and web browsing. As for the delivery, it arrived at my doorstep in a reasonable timeframe without any issues. However, the seller left a lot to be desired. They were unresponsive and uncooperative throughout the transaction, causing some unnecessary stress and inconvenience. But thankfully, the marketplace provided a safe and secure platform for the purchase, which I greatly appreciate.","neutral","neutral","negative","positive","4"
"Decent Mobile Phone with Average Buying Experience","I recently purchased a mobile phone that I am overall satisfied with. The device functions well and meets my expectations. However, the buying experience was not exceptional. There were some minor delays and hiccups during the process but nothing too significant. Overall, the seller was average, not particularly welcoming or unfriendly. The same goes for the marketplace where I bought the phone. They did not stand out either way. One thing worth mentioning is that the device came without any accessories, which could be considered a con for some users. In the end, I am happy with the phone despite the neutral buying experience.","positive","","neutral","neutral","4"
"Acceptable Mobile Phone, Less Than Optimal Marketplace Experience","I recently purchased a mobile phone, and while I do not have particularly positive or negative impressions about the item itself, there were some aspects of my experience that left me a little disappointed. First, the delivery process was smooth and efficient, arriving at my doorstep in a timely manner. However, I did not feel incredibly positive or negative about the seller I purchased from - they delivered as promised but did not go above and beyond. My biggest source of dissatisfaction lies with the marketplace, which I found to be less than optimal. Navigating website was not easy, and I encountered issues with the checkout process that were frustrating. Overall, while the mobile phone purchase was acceptable, the overall marketplace experience left something to be desired.","neutral","positive","neutral","negative","3"
"Excellent Smartphone with Good Quality Camera","I recently purchased a mobile phone and I am quite pleased with its features. The camera is of excellent quality that captures great photos even in low light. The user interface is smooth and easy to navigate, making it a perfect choice for people who are not fond of complicated gadgets. The battery performance is decent, lasting a whole day on a single charge. The phone also has ample storage space for pictures and apps. One aspect that could be improved, however, is the premium price tag. Nevertheless, it is a wise investment if the features of the phone align with what you need. Overall, this product meets my expectations and I am happy with my purchase.","","","","positive","4"
"Good phone with some drawbacks","I recently purchased a mobile phone that I am mostly satisfied with. It has a sleek design and the screen is large and bright. The camera takes decent pictures and is easy to use. I also appreciate the long battery life and the fact that it has expandable storage. However, there were some aspects of the purchase that were not ideal. The initial setup was a bit confusing and I had trouble figuring out how to transfer my data from my old phone. Additionally, the phone did not come with a protective case, which I had to purchase separately. Overall, I am happy with my phone and think it is a good value for the price. It has some drawbacks, but they are manageable.","negative","","","","4"
"Decent phone, but delivery was disappointing","The phone itself works well and seems to be a good purchase. Unfortunately, the delivery process was frustrating and time-consuming. Although the seller was pleasant to work with, the shipping was delayed and tracking information was not provided. As for the marketplace, I do not have much experience with it either way. Overall, if you have a little patience and do not need your item immediately, this could be a decent option.","positive","negative","positive","neutral","3"
"Great performance and durability for the price","This mobile phone has exceeded my expectations with its impressive battery life and fast processing speed. The camera quality is also admirable and it was relatively easy to set up the device. However, the screen resolution could be better and I would have appreciated more pre-installed apps. Overall, I am happy with my purchase and would recommend this phone to anyone looking for a reliable device that will not break the bank.","neutral","","","","4"
"Mixed experience with mobile phone purchase","I recently purchased a mobile phone online and have mixed feelings about the overall experience. While I have been satisfied with the phone itself, I found the delivery time to be longer than expected. Additionally, the seller did not provide clear communication about the shipment, which left me feeling frustrated. Overall, my experience with the platform used for the purchase was not a positive one either - I found it difficult to navigate and had issues finding the product that I wanted. It is unfortunate because I have used this platform before without significant issues. Despite the challenges I faced, I am content with the phone I received.","positive","neutral","negative","negative","3"
"Great Mobile Phone for Daily Use","I recently purchased a mobile phone that has been a reliable companion for my everyday use. The packaging was decent and it arrived on time. The phone works perfectly fine with all the necessary features that I need. It has a long battery life, screen size is appropriate and the camera quality is good. However, there are some aspects that I found lacking. The instruction manual was not detailed enough to follow through and sometimes had to resort to online tutorials. Overall, I highly recommend this mobile phone for anyone looking for a budget-friendly phone with great features to use in their daily lives.","","","neutral","","4"
"Great Purchase!","This mobile phone model is absolutely amazing, from its sleek design to its high functionality. The phone is incredibly user-friendly and a breeze to set up. The battery lifespan is also exceptional, lasting for a respectable amount of time on a single charge. However, the device's camera quality leaves a lot to be desired. Pictures taken in low-light environments were extremely pixelated and often disappointing. Another issue is the lack of storage space on the phone, which is quite concerning. This could become an instant problem if photographs or application installations increase. So, it is suggested to put this on using frequently-used apps, to save storage space. Overall it is worth-buying, a good quality phone that is ideal for standard smartphone use.","positive","","","","4"
"Great Mobile Phone for Daily Use","I recently purchased a mobile phone and have been very pleased with its performance. The phone has been great for my daily use, with the battery life lasting all day and the camera taking clear photos. The phone is also very lightweight and fits easily in my pocket. The only issue I experienced was with the process of obtaining the phone, but it does not affect the quality of the product. Overall, I am happy with my purchase and would recommend this phone to others.","","","","negative","4"
"Adequate Purchase Experience","The item arrived on time and in good condition. As for the seller, they were prompt in answering my initial questions, but I felt like the customer service could have been better. The marketplace, however, left a bit to be desired. The checkout process was confusing and at times, frustrating. Though the product itself met my expectations and I am content with the final outcome of the transaction.","positive","positive","neutral","negative","3"
"Solid performance, decent device","The mobile phone that I purchased came in a timely manner and the delivery process was smooth. The seller was communicative and responded promptly to inquiries. As for the device itself, it seems to perform satisfactorily. While it lacks some of the bells and whistles of more high-end models, it still functions well for daily use. The camera takes decent photos, although not the most high resolution or clear. One downside is that the device is a bit heavier than other smartphones I have had in the past. Overall, it is a decent device for the price.","neutral","positive","neutral","","3"
"Great Mobile Phone with Key Features","This mobile phone is surprisingly packed with features, including an excellent display and speed, as well as a large internal memory. The delivery was prompt but I was a bit disappointed with the lack of clear setup instructions. However, customer service was helpful in walking me through the process. The battery life could be better, but it charges quickly. For the price I paid, this phone is an excellent value.","","positive","","","4"
